<!ELEMENT FPTAPTECH (STUDENTS)*>
<!ELEMENT STUDENTS (NAME+,AGE+))>
<!ELEMENT NAME (FISTNAME,LASTNAME)>
<!ELEMENT FISTNAME (#PCDATA)>
<!ELEMENT LASTNAME (#PCDATA)>
<!ELEMENT AGE (#PCDATA)>

<!ATTLIST STUDENTS SEX (Female|Male) "Female">
<!ATTLIST AGE>